{
  "$schema": "https://json-schema.org/draft/2020-12/schema",
  "$id": "https://github.com/kai012N/reviewport/schema/manifest.schema.json",
  "title": "reviewport change manifest",
  "description": "A list of changes an AI agent made to a frontend, for a human to verify in the live UI. See docs/MANIFEST_SCHEMA.md.",
  "type": "object",
  "required": ["schemaVersion", "changes"],
  "additionalProperties": true,
  "properties": {
    "schemaVersion": {
      "type": "integer",
      "const": 1,
      "description": "Manifest format version. Currently 1."
    },
    "id": {
      "type": "string",
      "description": "Optional stable id for this review session. Used to namespace localStorage so two projects don't clobber each other's progress."
    },
    "generatedAt": {
      "type": "string",
      "description": "ISO-8601 timestamp of when the agent produced this manifest."
    },
    "agent": {
      "type": "string",
      "description": "Which agent produced this, e.g. 'claude-code', 'cline', 'cursor', 'aider'."
    },
    "task": {
      "type": "string",
      "description": "Short human description of the task the agent was asked to do."
    },
    "baseUrl": {
      "type": "string",
      "description": "Optional hint for where the dev site is served, e.g. http://localhost:5174."
    },
    "routeBase": {
      "type": "string",
      "description": "Optional path prefix prepended to every change.route, e.g. '/docs' when the app is served under a sub-path.",
      "default": ""
    },
    "defaults": {
      "type": "object",
      "description": "Optional defaults shallow-merged (one level deep) into every change; the change wins. Use for a shared optional top-level field like 'files' or 'severity'. Cannot supply nested keys (e.g. anchor.selector) or override required fields.",
      "additionalProperties": true
    },
    "changes": {
      "type": "array",
      "description": "The changes to review, in the order they should be walked through.",
      "items": { "$ref": "#/$defs/change" }
    }
  },
  "$defs": {
    "change": {
      "type": "object",
      "required": ["id", "route", "title", "category", "anchor"],
      "additionalProperties": true,
      "properties": {
        "id": {
          "type": "string",
          "description": "Unique, stable id within this manifest. Used for per-change accept/reject state and the export round-trip."
        },
        "route": {
          "type": "string",
          "description": "Path the change lives on, appended to routeBase for navigation. Use '.' to mean 'the current page, do not navigate' (single-page apps / demos)."
        },
        "title": {
          "type": "string",
          "description": "Short human-readable label for the change."
        },
        "category": {
          "type": "string",
          "description": "Free-form category. Suggested: copy, typo, structure, naming, css, layout, a11y, config, content, semantics, other.",
          "examples": ["copy", "typo", "structure", "naming", "css", "layout", "a11y", "config", "content", "semantics", "other"]
        },
        "severity": {
          "type": "string",
          "enum": ["info", "minor", "major"],
          "description": "Optional severity hint."
        },
        "description": {
          "type": "string",
          "description": "Optional longer explanation of what changed and why."
        },
        "files": {
          "type": "array",
          "items": { "type": "string" },
          "description": "Optional source files touched, for the 'anchor not found' fallback and traceability."
        },
        "before": {
          "type": "string",
          "description": "Optional previous value (shown struck-through)."
        },
        "after": {
          "type": "string",
          "description": "Optional new value (shown highlighted)."
        },
        "anchor": { "$ref": "#/$defs/anchor" },
        "status": {
          "type": "object",
          "additionalProperties": true,
          "properties": {
            "state": {
              "type": "string",
              "enum": ["pending", "approved", "rejected"],
              "description": "Optional carried hint. The reference viewer does not currently read or write this; review state lives in the browser's localStorage."
            }
          }
        }
      }
    },
    "anchor": {
      "description": "How to locate the change in the rendered page. A discriminated union on 'mode'. Resolution priority when authoring: text > code-marker > look-here.",
      "oneOf": [
        {
          "type": "object",
          "required": ["mode", "value"],
          "additionalProperties": true,
          "properties": {
            "mode": { "const": "text" },
            "value": { "type": "string", "description": "Visible text to find on the page (a unique-ish substring)." },
            "occurrence": { "type": "integer", "minimum": 1, "description": "Which match to use if the text appears more than once (1-based)." },
            "selector": { "type": "string", "description": "Optional CSS selector to scope the text search." }
          }
        },
        {
          "type": "object",
          "required": ["mode", "marker"],
          "additionalProperties": true,
          "properties": {
            "mode": { "const": "code-marker" },
            "marker": { "type": "string", "description": "A token/substring that appears in a rendered code block, used to mark the relevant line(s)." },
            "selector": { "type": "string", "description": "Optional CSS selector to scope the code search." },
            "lineHint": { "type": "string", "description": "Optional human hint about which line, shown in the panel." }
          }
        },
        {
          "type": "object",
          "required": ["mode", "hint"],
          "additionalProperties": true,
          "properties": {
            "mode": { "const": "look-here" },
            "hint": { "type": "string", "description": "Free-text 'look at this' instruction shown to the reviewer (for CSS/visual changes with no text anchor)." },
            "selector": { "type": "string", "description": "Optional CSS selector to highlight/scroll to." }
          }
        }
      ]
    }
  }
}
